<?xml version="1.0" encoding="windows-1251" standalone="no"?>
<DECLAR xmlns:xsi="http://www.w3.org/2001/XMLSchema-instance" xsi:noNamespaceSchemaLocation="J1391801.xsd">
    <DECLARHEAD>
        <TIN>39628794</TIN>
        <C_DOC>J13</C_DOC>
        <C_DOC_SUB>918</C_DOC_SUB>
        <C_DOC_VER>1</C_DOC_VER>
        <C_DOC_TYPE>0</C_DOC_TYPE>
        <C_DOC_CNT>83</C_DOC_CNT>
        <C_REG>26</C_REG>
        <C_RAJ>55</C_RAJ>
        <PERIOD_MONTH>12</PERIOD_MONTH>
        <PERIOD_TYPE>1</PERIOD_TYPE>
        <PERIOD_YEAR>2020</PERIOD_YEAR>
        <C_STI_ORIG>2655</C_STI_ORIG>
        <C_DOC_STAN>1</C_DOC_STAN>
        <LINKED_DOCS xsi:nil="true"/>
        <D_FILL>28122020</D_FILL>
        <SOFTWARE>CABINET 0.4.1</SOFTWARE>
    </DECLARHEAD>
  <DECLARBODY>
<HFILL>28122020</HFILL>
<HNUM>1</HNUM>
<HSTI>цнкнбме сопюбк╡ммъ доя с л.йх╙б╡, до╡ с оевепяэйнлс пюинм╡ (оевепяэйхи пюинм л.йх╙бю)</HSTI>
<HNAME>рнбюпхярбн г налефемнч бIдонбIдюкэмIярч "т╡мюмянбю йнлоюм╡ъ "нйрюбю т╡мюмя"</HNAME>
<HTIN>39628794</HTIN>
<T1RXXXXG1S ROWNUM="1">╡БЮМН-тПЮМЙЁБЯЭЙЕ БЁДДЁКЕММЪ ╧ 64 рнб "тй "нйрюбю т╡мюмя"</T1RXXXXG1S>
<T1RXXXXG2S ROWNUM="1">0039628794</T1RXXXXG2S>
<T1RXXXXG3S ROWNUM="1">b2476057a8f09375638d2c171dbba83e0fbb0121728f0c273fb633721bd2188c</T1RXXXXG3S>
<T1RXXXXG4S ROWNUM="1">йЮЯХП</T1RXXXXG4S>
<HBOS>ярнпнфсй б╡пю кенм╡д╡бмю</HBOS>
<HPOST>дХПЕЙРНП</HPOST>
<HEXECUTOR>ярнпнфсй б╡пю кенм╡д╡бмю</HEXECUTOR>
<HTEL>380671080445</HTEL>
</DECLARBODY>
</DECLAR>
